DOI,Sentence
10.1371_journal.pone.0207691,The data were analyzed using a mixed logistic regression model using PROC GLIMMIX in SAS 9.2 with Audience ID as a nested random effect within the random effect for Session.
10.1371_journal.pone.0093298,"To analyze time in mission effects, mixed model ANOVAs (Proc Mixed, SAS Version 9.3, SAS Institute Inc., Cary, NC) with a random intercept for crewmembers and unstructured covariance were performed with mission quarter (MQ) as the only explanatory variable (MQ1, days 1–130; MQ2, days 131–260; MQ3, days 261–390; MQ4, days 391–520) and with the scores from the mood scales (BDI-II and POMS-SF) and visual analog scales as outcome variables."
10.1371_journal.pone.0192764,"Information was double entered using Microsoft Excel for Windows, and then transferred to STATA version 12 (STATA Corp, College Station, TX, US) for analysis."
10.1371_journal.pone.0026761,All statistical tests were performed with GraphPad Prism® 4.
10.1371_journal.pone.0165343,"All images were acquired through the Matlab Image Acquisition Toolbox (Mathworks, Matlab v2011b) at 2 frames/s (500 ms exposure) at 360x260 pixel (px) resolutions (using 4x4 hardware binning)."
10.1371_journal.pone.0068444,"Statistical analyses were computed using SPSS version 19.0.1 (IBM, Somers, NY) and the plot was generated using Prism version 5.0d (GraphPad, La Jolla, CA)."
10.1371_journal.pone.0136027,"Preprocessing and statistical analysis of the fMRI data was performed with SPM8 (Wellcome Department of Cognitive Neurology, London UK) software for MATLAB (Version R2010a, The MathWorks Inc., Natick, MA)."
10.1371_journal.pone.0047335,Wilcoxon rank-sum tests were undertaken in Stata 11.
10.1371_journal.pone.0023236,"Statistical tests were carried out using SPSS 16.0 (SPSS Inc., Chicago, IL) for Windows."
10.1371_journal.pone.0097887,"Subsequently, we used a Butterworth filter in Matlab on the two time series of the positions, with a cut-off frequency of 4 Hz."
10.1371_journal.pone.0056105,"Analyses were performed using SPSS version 17.0 (Chicago, IL)."
10.1371_journal.pbio.2006328,"Then, we calculated separate linear mixed effects models for each of the six windows using the fitlme function in MATLAB."
10.1371_journal.pone.0056945,"All analyses were performed using the Statistical Package for Social Sciences software program, version 16 (SPSS, Inc., Chicago, IL, USA)."
10.1371_journal.pone.0093253,"All of the analyses were performed using SAS (SAS Institute Inc., USA)."
10.1371_journal.pone.0199877,"Data were analysed using STATA 12.0 (Stata Corp, College Station, TX, USA)."
10.1371_journal.pone.0090779,"The word ‘hello’ was extracted from each recording, and normalised for power (RMS) and loudness via Matlab (the Mathworks)."
10.1371_journal.pone.0150830,We built a generalized linear mixed model (GLMM) using the GLIMMIX procedure [43] in SAS v9.3 to identify factors associated with the occurrence of groups.
10.1371_journal.pone.0081237,For the permutation test we used Matlab v. 7.10.0.499.
10.1371_journal.pone.0048975,"All statistical analyses were carried out using GraphPad Prism version 5.04 for Windows, GraphPad Software, San Diego, CA, www.graphpad.com."
10.1371_journal.pone.0094767,"From week 12 to 16 pregnant ewes had free access to salt blocks (TIMAC SAS, St Malo, France) after which time blocks were substituted by a cube containing vitamin-mineral corrector (INAFORM, Timac Agro, Orcoyen, Spain)."
10.1371_journal.pone.0129040,"For analysing genotype effects in the purebred and intercross chickens, we used Generalized Linear Models (SPSS v. 22.0)."
10.1371_journal.pone.0161108,"Data were entered, cleaned and analyzed using SPSS version 16."
10.1371_journal.pone.0184525,"Statistical analyses were conducted using SPSS 23 (IBM Corp., Armonk, N.Y., USA)."
10.1371_journal.pone.0146382,All statistical analyses were performed using IBM SPSS Statistics v.22.
10.1371_journal.pone.0005987,"For the pre-processing and statistical analyses, the statistical parametric mapping software package (SPM5, Wellcome Department of Cognitive Neurology, London; www.fil.ion.ucl.ac.uk/spm) was used and implemented in Matlab (Mathworks, Inc., Natick, MA, USA release 14)."
10.1371_journal.pone.0033028,"All data was analyzed using SPSS 14.0J (SPSS Inc., Chicago, IL) statistical package."
10.1371_journal.pone.0097299,"All data analysis was performed offline in MATLAB environment (version R2010a, The MathWorks, Natick, MA) in a way that will allow later straightforward automatization of the analytic procedure."
10.1371_journal.pone.0023105,"Non-parametric tests were applied using SPSS 17.0 (SPSS Inc.), with the level of significance set at alpha = 0.05."
10.1371_journal.pone.0188962,Analyses were conducted in Stata 12.
10.1371_journal.pone.0013531,"The results of E-β-ocimene influence on honey bee behavioural development were analysed with a two-ways ANOVA (years and treatments) followed by Fisher post-hoc test (STATVIEW 5.0, SAS Institute, Cary, NC)."
10.1371_journal.pone.0196729,Statistical analyses were carried out using Stata 14.1.
10.1371_journal.pone.0147654,The IBM Statistical Package for the Social Sciences (SPSS-22) software was used to analyze the quantitative data.
10.1371_journal.pone.0053246,All regression analyses were performed using SPSS Statistics 19 [37] with a significance level at 0.05 and 95 percent confidence intervals.
10.1371_journal.pone.0191405,"All analyses were performed using R version 3.2.4 (Vienna, Austria) and STATA version 14 (College Station, Texas)."
10.1371_journal.pone.0158332,We conducted the analysis in STATA (version 13.1).
10.1371_journal.pone.0049714,"The data was analyzed using SPSS® version 17.0 (SPSS Inc., Chicago, IL, USA) for Windows®."
10.1371_journal.pone.0053114,"Statistical analysis was conducted using StatView (SAS Institute, Cary, NC)."
10.1371_journal.pone.0086127,"As there was a group difference for BPVS and SAS scores (see Table 2), all analyses include these scores as covariates to partial out the variance attributed them."
10.1371_journal.pone.0095146,"Conventional statistical analysis was performed on the mean whole brain SampEn and H values of each subject in both groups using the Statistical Package for Social Sciences (SPSS 18.0; Chicago, IL, USA) software."
10.1371_journal.pone.0211470,"All analyses were performed in Stata version 13.1 (Stata Corp, Texas, USA)."
10.1371_journal.pone.0145673,"Statistical analyses were conducted using SAS software, version 9.3 (PROC GENMOD, with options REPEATED, CORR = IND, DIST = BINOMIAL, LINK = LOGIT; SAS Institute, Inc., Cary, NC), and a P < 0.05 was considered statistically significant."
10.1371_journal.pone.0206889,These time series were subsequently decomposed into two components using non-negative matrix factorization [39] (as implemented in MATLAB R2016b [38]).
10.1371_journal.pone.0175713,"Data were analyzed using GraphPad Prism version 6.0f for Mac OS X, (GraphPad Software, La Jolla California USA, www.graphpad.com)."
10.1371_journal.pone.0132340,These final effect sizes and their standard errors were then input to STATA together with relevant study information for the subgroup analysis.
10.1371_journal.pone.0203543,"Then, we conducted one-way analyses of variance (ANOVA) with Dunnett’s test or T3 tests using SPSS 12 for Windows® (SPSS, Chicago, IL, USA) to determine significant differences between the control and VPA exposure groups."
10.1371_journal.pone.0109392,"All statistical analyses that include independent samples t-tests, Cohen's effect size value, Pearson correlations, one-way analysis of variance (ANOVA) and 3*2 mixed-design, ANOVA were performed on the Software Package for Statistical Analysis (SPSS for Windows version 19.0), [24]."
10.1371_journal.pone.0173342,"[27] STATA 13.0 was used for analysis in 2015, using the svy suite, given the sample design."
10.1371_journal.pone.0175923,All data were analyzed with SPSS version 21.0 [34].
10.1371_journal.pone.0143749,The univariate logistic regression analysis procedure in the complex samples add-on module in SPSS was used to test the differences between the male and female subjects on HIV stigma discrimination against PLWHA.
10.1371_journal.pone.0155313,The data were prepared for analysis using Stata v13 [48] and the structural equation models were estimated using Mplus v7 [46].
10.1371_journal.pone.0200313,The statistical software IBM SPSS Statistics version 22 [39] and R [40] were used for the statistical analyses.
10.1371_journal.pone.0102880,"All analyses (except repeatability calculations) were run using JMP 9 (SAS Institute, Cary, NC) and we analyzed residuals to assess violation of ANOVA assumptions."
10.1371_journal.pone.0047653,All the statistical analyses were carried out with IBM SPSS Statistics 19.
10.1371_journal.pone.0096534,"The following preprocessing procedures were performed using Statistical Parametric Mapping (SPM8) software (Wellcome Department of Imaging Neuroscience; London, UK) implemented in MATLAB R2009b (MathWorks; Natick, MA, USA) for whole brain analysis: correction for head motion, adjustment of acquisition timing across slices, spatial normalization using the MNI template, and smoothing using a Gaussian kernel with a full width at a half-maximum of 5 mm."
10.1371_journal.pone.0181610,"In the lose condition, participants received 8 noise blasts, one each after the 8 rounds they lost (noise blast sequence: 60, -, 70, 80, -, 100, 90, 90, 90, 90, 90)."
10.1371_journal.pone.0197860,"All of the statistical analyses were conducted using SPSS17.0 (SPSS Inc., Chicago, IL, USA)."
10.1371_journal.pone.0199924,The statistics software SPSS 24 was used to perform descriptive data analysis in each sample (male and female) separately.
10.1371_journal.pone.0173525,"MNI coordinates for the channels were obtained using the NIRS_SPM software [40] with MATLAB (Mathworks, Natick, MA), and the corresponding anatomical locations of each channel were determined by the atlas provided [41, 42] and shown in S1 Table."
10.1371_journal.pone.0160360,All statistical analyses were performed with the Mplus statistical package version 7.3 and IBM SPSS version 22.
10.1371_journal.pone.0023889,"We used SPSS v.17 to estimate univariate Spearman Rank correlations, and partial correlation and multiple regression with backwards exclusion to identify associations with smoking prevalence that were independently significant at p<0.05."
10.1371_journal.pone.0046597,"Text files of the R-R interval data were extracted from the Polar watch and were entered into Kubios HRV (version 2.0, 2008, biosignal analysis and medical imaging group, University of Kuopio, Finland, MATLAB)."
10.1371_journal.pone.0188234,"Data were analyzed using SAS version 9.4 (SAS Institute, Carey, NC)."
10.1371_journal.pone.0208925,All statistical analyses were conducted using Stata (v.14).
10.1371_journal.pone.0110907,"The data were analyzed with MIXED procedure in the IBM SPSS Statistics software, version 21 (IBM Corporation, Armonk, New York, USA)."
10.1371_journal.pone.0073519,"All further statistical analyses (t-tests for dependent samples) were calculated using the software package SPSS 11.5 (SPSS Inc., Chicago, USA)."
10.1371_journal.pone.0090309,All analyzes were conducted using SPSS (version 20).
10.1371_journal.pone.0018521,SPSS and SAS were both used to analyse the data.
10.1371_journal.pone.0009708,Calibrations of eye fixations were conducted at the beginning of the experiment using a nine-point fixation procedure as implemented in the EyeLink API (see EyeLink Manual) and using Matlab software.
10.1371_journal.pone.0102471,"To create a set of control stimuli that retained acoustic correspondence, we synthesized nonvocal sounds by using Praat [44] and MATLAB (The MathWorks, Inc., Natick, MA, USA)."
10.1371_journal.pone.0024858,"The data were analyzed using SPSS software (Statistical Package for the Social Sciences, version 17.0)."
10.1371_journal.pone.0208623,All analyses were performed using Stata 14.2 [36].
10.1371_journal.pone.0192999,"All statistical analyses were carried out with SAS, version 9.3 (SAS Institute Inc., Cary, NC) except for meta-analyses, which were performed using Comprehensive Meta-Analysis Version 2.2.027 software (Biostat, Englewood, NJ)."
10.1371_journal.pone.0165634,"All the analyses were performed using Stata 12® (Stata Corporation, College Station, TX) and accounted for the complex sampling design and the data weighting so that the estimates are representative of the entire population of HIV-infected individuals followed at hospitals in France."
10.1371_journal.pone.0195078,All data were entered into the IBM Statistical Package for the Social Sciences (SPSS) 18.
10.1371_journal.pone.0157909,Calculations were done using SPSS 20.
10.1371_journal.pone.0025035,All computations were done using SAS V9.2.
10.1371_journal.pone.0073102,"The results are presented as a set of predicted probabilities of being fully immunized, estimated using logistic regression post-estimation command available in Stata 10.0 [52]."
10.1371_journal.pone.0204213,"Data analysis was conduct using SPSS 17.0 (IBM, Chicago, IL,USA) and Mplus 6.1."
10.1371_journal.pone.0199977,"Descriptive statistics of survey data were performed in STATA (Version 13; STATA Corp, College Station, TX, USA)."
10.1371_journal.pone.0127644,"Reliability analysis of the data and univariate analyses were performed using SPSS version 16.0 (SPSS Inc., Chicago, IL, USA) for Windows, and the SEM was produced using LISREL 8.5. χ2, RMSEA (root mean square error of approximation), SRMR (standardized root mean square residual), GFI (goodness-of-fit index), AGFI (adjusted goodness-of-fit index), and IFI (incremental fit index) were used to indicate whether the model was an adequate fit [34]."
10.1371_journal.pone.0104136,The API calls can be run on a specific tab in the Excel to analyze tweets.
10.1371_journal.pone.0188931,"All statistical analyses were conducted using SAS 9.3 software package (SAS Institute, Cary, NC, USA)."
10.1371_journal.pone.0192998,STATA version 13 was used to perform all statistical analyses.
10.1371_journal.pone.0159086,Regression models were estimated using IBM SPSS Version 22.
10.1371_journal.pone.0081725,"All subsequent analysis was performed with Matlab (Mathworks, Natick, MA, USA)."
10.1371_journal.pone.0136208,"We used the AMOS extension to IBM SPSS (v. 21.0) for structural equation modeling in order to identify associations of AR CAG repeat number, ethnicity and age with the number of children, mediated through BPAQ aggression scores."
10.1371_journal.pone.0151299,"Given that some families contributed more than one subject, hierarchical clustering of data was taken into account by including a family as a random effect in a linear mixed model, using the stata xtmixed command, fitted with restricted maximum likelihood estimation."
10.1371_journal.pone.0092550,"STATA version 11.2 software (STATA Corp, College Station, TX, US) was employed for our analyses."
10.1371_journal.pone.0146085,"All statistical tests were conducted in Stata 11 (Stata Corp., College Station, TX [41])."
10.1371_journal.pone.0094007,"All analyses were performed using STATA 11.0 (Statacorp, College Station, TX)."
10.1371_journal.pone.0029991,"The 2006-survey data were double entered and cleaned in Epi Info 6.04 (CDC, Atlanta; WHO, Geneva 1996), and analyzed with STATA 9.0 software (Stata Corp., College Station, TX)."
10.1371_journal.pone.0166345,"Associations with teenage motherhood were modeled using multilevel logistic regression of the above structure using STATA MP statistical package version 14 (StataCorp L, College Station, Texas, USA)."
10.1371_journal.pone.0135109,All statistical analysis was conducted in Minitab 16 (Minitab Ltd).
10.1371_journal.pone.0123391,"The Matlab statistics toolbox was used for statistical analysis of the intensity data of the 25 hybridizations from five different treatments (SC, F, B, I, F+I or B+I)."
10.1371_journal.pone.0195495,We imputed the data under an MAR assumption through multiple imputation using chained equations (Stata ICE package).
10.1371_journal.pone.0115885,The data were tabulated and analyzed using software Epi-Info version 3.5.2 and SPSS version 19.
10.1371_journal.pone.0128248,Mediation analysis was carried out with the commands “binary_mediation “and “bootstrap” in Stata 13 [52].
10.1371_journal.pone.0182736,We loaded the transcripts into MAXQDA 11 which is a software tool used to analyze qualitative data [88].
10.1371_journal.pone.0104225,"We undertook analyses in STATA, version 12."
10.1371_journal.pone.0083558,The actual CVI was a proportion of the items that received a rating of 3 or 4 by the experts.Socio-demographic characteristics and SAS-SV scores.
10.1371_journal.pone.0066204,SPSS version 18 is used for this analysis.
10.1371_journal.pone.0071085,"All statistical analyses were done in Stata 12 (Stata Corp. Inc. TX, USA)."
10.1371_journal.pone.0086237,"For the Alternating EE paradigm, statistical analyses were performed using SAS 9.3 statistical analysis software (SAS Institute)."
10.1371_journal.pone.0022971,"Therefore, an individual can be traced from household to household over the course of his or her life (as long as he or she resides in the Matlab study area)."
10.1371_journal.pone.0181132,"Analysis was then done by one researcher (SS) using MSOffice (Word and Excel, Microsoft Corp.) and NVivo (QSR International) software for qualitative data analysis."
10.1371_journal.pone.0150491,Quantitative data was analysed in SPSS using descriptive statistics.
10.1371_journal.pone.0198162,Survey responses were analyzed using STATA 15 [16].
10.1371_journal.pone.0202012,Data were analysed with IBM SPSS version 22.0 for Windows.
10.1371_journal.pone.0053879,"The data were analyzed using the Statistical Package for the Social Science (SPSS), version 17.0."
10.1371_journal.pone.0145265,For statistical analysis we used Stata.
10.1371_journal.pone.0182544,SPSS software (IBM SPSS statistics version 21) was used for statistical analyses.
10.1371_journal.pone.0197552,"Analyses were conducted using SPSS version 22.0 statistical software packages (SPSS, Chicago IL, USA)."
10.1371_journal.pone.0195693,All statistical analyses were performed with SAS (V 9.1.3) on a Win7 (64 bit) platform.
10.1371_journal.pone.0197020,"This negative binomial mixed model regression was run using Stata 13.0 (StatCorp, College Station, TX)."
10.1371_journal.pone.0185341,SPSS (version 22) was used for all analyses.
10.1371_journal.pone.0186610,Data are weighted to control for the survey design and random intercept models run in Stata 13 [30].
10.1371_journal.pone.0147654,The IBM Statistical Package for the Social Sciences (SPSS-22) software was used to analyze the quantitative data.
10.1371_journal.pone.0020722,A BLAST search [40] confirmed the absence of contamination with exogenous DNA.
10.1371_journal.pone.0155607,"The distributions of CES-D, SAS and PCL-C in categorical variables were calculated using independent sample t-test and one way analysis of variance (ANOVA)."
10.1371_journal.pone.0053144,"Tests on initiatorship and overtaking were run with PASW Statistics 18 (SPSS Inc., Chicago, IL, 2009), the other tests were run using R software (R Development Core Team, Vienna, Austria, R2.11.1)."
10.1371_journal.pone.0026641,"Four partial EST sequences for hexamerin (contigs 45616, 45913, 42334 and 40833: http://stan.cropsci.uiuc.edu/454/blast/waspblast.html) were available from the Polistes wasp EST data set to design primers."
10.1371_journal.pone.0161923,All analyses were conducted using Stata version 13[41].
10.1371_journal.pone.0015268,"Images were preprocessed and analyzed using SPM5 (Wellcome Department of Cognitive Neurology, London, UK), implemented in MatLab 7.2 (MathWorks™)."
10.1371_journal.pone.0183799,"The GBVS algorithm is available as Matlab® source code, it is applicable without initial training and it performs well in predicting fixations in free viewing conditions [20,21]."
10.1371_journal.pone.0173515,All statistical analyses used Stata v14 (StataCorp 2015) or R v3.2.2 (www.R-project.org).
10.1371_journal.pone.0056936,"As with the first SAS, the term “Internet” in Y-scale was changed to “smartphone.” In this study, the internal-consistency test result (Cronbach's alpha) of Y-scale was 0.95."
10.1371_journal.pone.0066222,All analyses were conducted using SPSS version 21.
10.1371_journal.pone.0073519,"Further analyses regarding behavioural data (t-test for paired samples) were carried out using SPSS 11 (SPSS Inc., Chicago, USA)."
10.1371_journal.pone.0002023,The resulting mean values for the activated regions were entered in an ANOVA (SPSS 11.5) comparison of the different conditions and regions.
10.1371_journal.pone.0184008,We used Support Vector Machine (SVM) with linear kernel (using Matlab functions “svmtrain” and “svmclassify”) as multivoxel pattern classifier for discriminating between social vs. individual action intention.
10.1371_journal.pone.0107621,"SPSS Statistics 20.0.0 statistical software (SPSS Inc., Chicago, IL) was used for all statistical analyses."
10.1371_journal.pone.0141953,"To estimate the prevalence of SRH and SRD by gender, we used STATA S.E."
10.1371_journal.pone.0207814,"Typed responses were imported into an Excel 2016 spreadsheet where each individual response was associated with participant diagnosis, memory specificity, and rated valence."
10.1371_journal.pone.0192925,"20.0; SPSS Inc., Chicago, IL, USA)."
10.1371_journal.pone.0100914,Higher scores on the SDS or SAS indicated a higher level of mental disorder.
10.1371_journal.pone.0159551,All such interviews were conducted by native language interviewers in each country using CATI-SPSS Dimensions software.
10.1371_journal.pone.0093594,All data were analyzed in SPSS using macros for meta-analysis [60].
10.1371_journal.pone.0173826,"All data were analyzed by SPSS (Version 23) by univariate and multivariate procedures, using two-sided t-tests and Chi2, respectively."
10.1371_journal.pone.0143386,"Statistical analyses were performed using Prism v.6.0 (GraphPad Software, Inc., La Jolla, CA) and SPSS software (Chicago, IL), with a significance level of p<0.05."
10.1371_journal.pone.0113618,All statistical analyses were performed using SPSS 12.0.
10.1371_journal.pone.0193616,"All analyses were performed using SPSS (Version 22, release 22.0.0.2, IBM Corp., USA)."
10.1371_journal.pone.0070297,"For the statistical analysis a statistical Software package (SPSS 17.0, Inc., Chicago, IL, USA) was used in order to perform independent T-tests and Mann-Whitney U tests for the comparison of the prevalence of temporary and permanent tinnitus per age category and for the analysis of the scores on the YANS and BAHPHL."
10.1371_journal.pone.0056091,Statistical analyses were conducted using the Statistical Package for the Social Science (SPSS) version 19.0 and a p-value of less than 0.05 was used to define statistical significance.
10.1371_journal.pone.0066571,"All statistic analyses were computed using Statistical Package for Social Science (SPSS, Chicago, Illinois, USA) software version 19.0 for Windows."
10.1371_journal.pone.0190117,"Apart from Microsoft Excel [20] used to manage qualitative data, the statistical software Stata version 12 [21] was used to generate Table 1."
10.1371_journal.pone.0153318,Analyses were performed in SPSS version 22.
10.1371_journal.pone.0194919,"All analyses were conducted using SPSS version 24.0J (IBM Japan, Tokyo, Japan)."
10.1371_journal.pone.0168303,We used the SAS system (version 9.3 SAS Institute Inc.) for statistical analysis.
10.1371_journal.pone.0052371,"For statistical analyses, the software package SPSS 18.0 (SPSS Inc., Chicago, IL, USA) was used."
10.1371_journal.pone.0037177,"All analyses were conducted using Stata version 11 (StataCorp, College Station, Texas) and Excel version 2007 (Microsoft Corporation, Redmond, Washington)."
10.1371_journal.pone.0187691,All statistics were performed in STATA®/MP 13 software.
10.1371_journal.pone.0190750,Chicago: SPSS Inc.
10.1371_journal.pone.0004983,"Comb area, T and CORT concentrations were log-transformed and fitted to models using a normal error distribution (GLM or Mixed procedures; SAS, 2001)."
10.1371_journal.pone.0005707,"These measurements were analyzed using SPSS to investigate whether apparent size in the two-dimensional plane that is visible to a perceiver varied across low, neutral, and high status cues."
10.1371_journal.pone.0103849,"This was performed using the svyset and svy commands in Stata Version 12.1 (StataCorp, 4905 Lakeway Drive, College Station, Texas 77845, USA)."
10.1371_journal.pone.0058176,Statistical analyses were conducted using Statistical Package for the Social Sciences Version 20.0 (SPSS 20.0) and Analysis of Moment Structures Version 20.0 (AMOS 20.0).
10.1371_journal.pone.0143118,Chicago: SPSS Inc.).
10.1371_journal.pone.0195200,Convenient integration between Matlab and Google Cloud was achieved through using a software called Techila Technologies.
10.1371_journal.pone.0062701,Data from the tracking software was converted into Microsoft Excel format to allow further data analysis.
10.1371_journal.pone.0069481,"The normality tests, repeated measures and multivariate ANOVAs, Student t-test (two-tailed) and Mann-Withney analysis were done using SPSS statistic 19.0 (IBM)."
10.1371_journal.pone.0156216,All analyses were conducted with Stata 14.1 using sampling weights and the suite of svy commands to accurately estimate standard errors.
10.1371_journal.pone.0201095,Studies were exported to remove the duplicates in Refworks™ and then exported to Microsoft Excel.
10.1371_journal.pone.0191632,Data were entered using EpiData 3.0 and all statistical analyses were performed using SPSS 10.01.
