DOI,Sentence
10.1371_journal.pone.0083558,Smartphone Addiction Proneness Scale (SAPS) was added to verify the concurrent validity of SAS-SV.
10.1371_journal.pone.0101034,All analyses were conducted using Stata 12.1 [44].
10.1371_journal.pone.0198867,The task was written in Matlab and presented using Psychophysics Toolbox.
10.1371_journal.pone.0118484,"Data analysis was performed using the Statistical Package for the Social Sciences (SPSS for Windows, version 19.0, SPSS Inc, Chicago, IL, USA) and included frequency distribution and association tests."
10.1371_journal.pone.0077645,We also used STATA 10.0 to calculate the equilibrium and Deff.
10.1371_journal.pone.0191255,"We analyzed data in Stata version 14.0 (StataCorp, College Station, Texas)."
10.1371_journal.pone.0157635,The distribution of individual mean values within these categories fitted to a normal distribution according to the Kolmogorov-Smirnov-Test as implemented in SPSS 22.0.
10.1371_journal.pone.0106758,The analyses were performed using SPSS version 18 software.
10.1371_journal.pone.0152765,"All statistical analyses were performed using SAS System for Windows version 9.3 (SAS Institute, Cary, NC)."
10.1371_journal.pone.0094006,"All statistical analysis was carried out with STATA 12.0, Statacorp, College Station, Texas, USA."
10.1371_journal.pone.0065085,All statistical analyses were carried out with SPSS 19.0 software for Windows.
10.1371_journal.pone.0206932,"SPSS version 19.0 (SPSS Inc., Chicago, Ill., USA) was used for statistical data analysis."
10.1371_journal.pone.0051755,The allocation of participants to samples has been performed randomly by applying the option of a random selection of cases in SPSS 18.
10.1371_journal.pone.0160787,Individual treatment reports are all constructed in these excel documents.
10.1371_journal.pone.0143203,"Recorded songs were filtered at 0.3–8 kHz for analysis using software in the Matlab Programming language (The MathWorks, Natick, MA)."
10.1371_journal.pone.0142955,"SPSS version 22.0 (SPSS, Inc.), R [42] and EpiTools [43] programs were used to explore our datasets."
10.1371_journal.pone.0191632,Data were entered using EpiData 3.0 and all statistical analyses were performed using SPSS 10.01.
10.1371_journal.pone.0088586,Statistical analysis was carried out using STATA 11.2 [18].
10.1371_journal.pone.0184327,All analyses were done using IBM SPSS Statistics 20 (IBM Corp 2011) [35].
10.1371_journal.pone.0200519,"Based on two-sample Wilcoxon rank-sum test with a two-tail test α of 5% with 80% power, it was estimated that at least 96 mother-child pairs would be required to detect a 20% difference in the mean duration of ABF between the intervention and control groups (POWER procedure, SAS Version 9.3, SAS Institute, Cary, NC, USA)."
10.1371_journal.pone.0062322,"Genetic correlations with antipsychotics dosage, PANSS score, and altruistic tendency were analyzed using the linear-by-linear association test, Mann-Whitney U test and linear regression tests in the SPSS v11.5 package (SPSS, Chicago, IL, USA)."
10.1371_journal.pone.0055503,"We conducted all analyses in SAS [45], and used residual analyses to confirm the usual normality and homoscedasticity assumptions."
10.1371_journal.pone.0172204,We used STATA 13.1 for the univariate and multivariate statistical analyses.
10.1371_journal.pone.0174512,The main outcome criterion was the “couple” SAS domain score obtained 1 year after surgery in PD patients.
10.1371_journal.pone.0143579,"Stata version 13.1 (Stata Corp LP, College Station, Texas) was used to estimate the analysis models."
10.1371_journal.pone.0095894,"Statistical analyses were performed using SPSS for Windows software version 15.0 (SPSS Inc., Chicago, IL)."
10.1371_journal.pone.0162039,"All preprocessing, time–frequency SPM analyses, and ERP analyses were performed using SPM8 (http://www.fil.ion.ucl.ac.uk/spm) implemented in MATLAB R2012b (MathWorks)."
10.1371_journal.pone.0190442,"Data processing and statistical analyses were conducted using IBM SPSS 22.0 (IBM Corp., Armonk, NY), MATLAB R2015a (The MathWorks, Natick, MA), R 3.3.2 (http://www.R-project.org/), and Python libraries for scientific computation (NumPy, and SciPy) [39]."
10.1371_journal.pone.0096460,"The Statistical Package for the Social Sciences (SPSS) Version 19.0 (SPSS, Chicago, IL) and XLSTAT (Addinsoft SARL, Germany) were used to conduct analyses."
10.1371_journal.pone.0065504,"The data were entered into Epi Info version 6 and transferred into SPSS version 17 (SPSS Inc, Chicago, IL, USA)."
10.1371_journal.pone.0167991,All statistical analyses were performed in SPSS 23.
10.1371_journal.pone.0102172,"For questions for which answers could be “yes,” “I don't know” or “no,” (e.g., “Did any of the field sites have a code of conduct?”), KH and JR conservatively bifurcated responses into “yes” and “not yes.” Chi-square, t-test, and regression models were constructed in JMP 9.0 (SAS, Inc)."
10.1371_journal.pone.0194763,We used the Statistical Package for Social Sciences (IBM SPSS v. 24.0.0.0) for all analyses.
10.1371_journal.pbio.2002556,All other processing and the analysis of the data were performed using Matlab 8.
10.1371_journal.pone.0051158,"The ANOVAs and linear contrasts were performed with SAS version 8.1 (SAS Institute Inc.), while the correlation analyses were performed with JMP (SAS Institute Inc.)."
10.1371_journal.pone.0146956,Data were statistically analyzed using SPSS Statistics 20.0.0.1.
10.1371_journal.pone.0008483,The simulations were run in Excel from Microsoft Office.
10.1371_journal.pone.0072481,"Data were analyzed using SPSS for Windows (version 20.0, 2012, SPSS Inc., Chicago, IL, US)."
10.1371_journal.pone.0183788,Codes developed from the qualitative data on motivators and quantitative data on demographic characteristics were entered in to SPSS version 21 for analysis.
10.1371_journal.pone.0198423,"With the aim of further refining the variable assessment of the phenomenon and attending to its specificity, an extra field ‘general comments’ was added to the Excel matrix, which allowed us to qualitatively address specific aspects that had driven the usage of a specific code and that later would help us to refine the definition by category and code."
10.1371_journal.pone.0088586,Statistical analysis was carried out using STATA 11.2 [18].
10.1371_journal.pone.0129478,The raw data are available as Supporting Information file S1 Dataset (in Excel format).
10.1371_journal.pone.0117359,Analyses were performed using SPSS 14.0.
10.1371_journal.pone.0185733,"Instead, we applied a custom built MATLAB routine (using the speech processing toolbox ‘voicebox’ in MATLAB v. R2014a) to extract acoustic ‘features’ (mel-frequency cepstral coefficients; MFCCs) from single screams and chorus excerpts."
10.1371_journal.pone.0090789,"All analyses were performed using STATA 11 (Stata Corporation, College Station, TX, U.S.A.)"
10.1371_journal.pone.0171316,"All analyses utilized weighted data proportional to sampling probability with village, GV, and health facility cluster weights; standard errors were computed using SAS 9.3 and STATA 14 procedures to account for the complex sampling design."
10.1371_journal.pone.0192909,"All analyses were undertaken using Stata 15.0 (StataCorp, College Station TX)."
10.1371_journal.pmed.1002159,Data analysis was performed using STATA 13; a statistical analysis plan was developed prior to endline data collection and discussed with the funder and program implementers.
10.1371_journal.pone.0085224,Data were statistically analyzed using SPSS Statistics 20.0.0.1.
10.1371_journal.pone.0173457,"Offline filtering and heart beat detection were also conducted in AcqKnowledge before the data were exported into SPSS (Version 23, IBM Corp, USA, NY)."
10.1371_journal.pone.0084339,Analysis of the data occurred using SPSS.
10.1371_journal.pone.0065274,Stimulus presentation and timing of all stimuli and response events were achieved using Matlab (Mathworks) and Psychtoolbox (www.psychtoolbox.org) on an IBM-compatible PC.
10.1371_journal.pone.0157119,"Descriptive statistics of the outcome measure, psychological distress, and the percentage distribution of the variables in the sample were calculated using SPSS Complex Samples, weighting for gender, age and city district."
10.1371_journal.pone.0031660,Random effects meta-regressions were also performed in Stata using the package metareg [44].
10.1371_journal.pone.0125105,"Recommendations, defined as strong declarative statements [27] that were actionable and applicable by a multidisciplinary intersectoral team of professionals in a comprehensive hospital-based elder abuse intervention, as determined by the research team, were collected in a separate excel table."
10.1371_journal.pone.0096632,"All statistical comparisons were performed within GraphPad Prism 5 (GraphPad Software, Inc., La Jolla, CA)."
10.1371_journal.pone.0056674,"All analyses were conducted in Stata v.12 (StataCorp, TX, USA)."
10.1371_journal.pone.0079777,GenBank match denotes the GenBank accession number of the closest GenBank BLAST match.
10.1371_journal.pone.0022093,The sound data obtained were analyzed using SAS Lab Pro (Avisoft).
10.1371_journal.pone.0185815,"Measurement model analysis was conducted using AMOS 23, whereas the remaining analyses were computed using SPSS 23."
10.1371_journal.pone.0189607,"We conducted analyses using the complex survey functions of Stata (version 14) to incorporate weighting, clustering, and stratification of the Natsal-3 data."
10.1371_journal.pone.0165359,"Initial descriptive statistics were calculated in MS Excel®, with subsequent statistical analysis conducted using IBM SPSS Statistics v22®."
10.1371_journal.pone.0122085,All quantitative analyses were conducted using SPSS Statistics 21.
10.1371_journal.pone.0210587,Data extraction was managed in Microsoft Excel using a data extraction proforma developed specifically for this review.
10.1371_journal.pone.0210183,"Analyses were conducted using SPSS version 24 for Mac (IBM SPSS Statistics for Windows, Version 23."
10.1371_journal.pone.0186651,"We used SAS 9.4 (SAS Institute, Cary, NC, USA) for data set-up and analyses."
10.1371_journal.pone.0155313,The data were prepared for analysis using Stata v13 [48] and the structural equation models were estimated using Mplus v7 [46].
10.1371_journal.pone.0147712,Analyses were conducted using SPSS version 20.0.
10.1371_journal.pone.0197483,The multiple mediation analysis was performed using PROCESS for SPSS [29].
10.1371_journal.pone.0162039,"All preprocessing, time–frequency SPM analyses, and ERP analyses were performed using SPM8 (http://www.fil.ion.ucl.ac.uk/spm) implemented in MATLAB R2012b (MathWorks)."
10.1371_journal.pone.0151783,All analyses were performed using Stata 12.0 SE.
10.1371_journal.pone.0168858,"The visual stimuli were generated using Psychophysics toolbox [49–51] in MATLAB (The MathWorks Inc., Natick, MA)."
10.1371_journal.pone.0071922,"To evaluate whether the eight items formed a one-dimensional homogenous scale we performed Mokken Scale analysis for polytomous items [34], using the STATA 12.1 command MSP [35]."
10.1371_journal.pone.0095894,"Statistical analyses were performed using SPSS for Windows software version 15.0 (SPSS Inc., Chicago, IL)."
10.1371_journal.pone.0102820,"SAS version 9.2 was used for all analyses (SAS Institute Inc., Cary, NC, USA, 2000–2008)."
10.1371_journal.pone.0162646,Data were analyzed using SAS® 9.2 and STATA® 12 statistical software®.
10.1371_journal.pone.0079777,"As cut off criteria in the BLAST searches we used a minimum alignment length of 100nt, E-value 0.001 a word size of 11, and a minimum of 70% sequence identity."
10.1371_journal.pone.0130474,"In order to investigate whether sex and body weight could influence the inter-individual variation in the behavioural responses (reflected in the PCs), we performed a general linear model (GLM) as well as linear regressions using SAS."
10.1371_journal.pone.0067887,Analyses were performed by using the statistical package STATA version 11.
10.1371_journal.pone.0065442,"Using SPSS version 18, inter-rater agreement prior to discussion and consensus was calculated as κ = 0.71, indicating substantial agreement."
10.1371_journal.pone.0148440,"The data were managed and analyzed using the statistical software package SPSS (Version 18.0 for Windows SPSS, Inc., Chicago, Ill)."
10.1371_journal.pone.0205197,"Moreover, to assess the statistical significance of the frequency of interactions won, we performed a binomial test using the GraphPad software (www.graphpad.com)."
10.1371_journal.pone.0189023,"All three stages of analysis were conducted using SPSS software (IBM SPSS Statistics 20, IBM Corporation)."
10.1371_journal.pone.0121970,"The automatic classification was performed in MathWorks Matlab, using the PRTools toolbox [57]."
10.1371_journal.pone.0195671,"Cases were extracted from the transcripts with the help of qualitative data analysis software, MaxQDA (version 12), and coded using framework analysis."
10.1371_journal.pone.0146886,Lesion and whole brain areas for each slice were brought into Excel for final volume calculations.
10.1371_journal.pone.0152233,These analyses were performed using IBM SPSS v. 21.
10.1371_journal.pone.0069481,"Linear regression analyses were performed using statistical analyses software (SAS 9) version 9.2 (SAS Institute, Cary, NC)."
10.1371_journal.pone.0166418,"All statistical analyses were performed using the SPSS 19.0 software package (SPSS Inc., Chicago, IL, USA).P-values<0.05 were considered statistically significant."
10.1371_journal.pone.0116542,"All the statistical analyses were conducted using IBM SPSS Statistics, version 20.0."
10.1371_journal.pone.0190750,Chicago: SPSS Inc.
10.1371_journal.pone.0138887,"“Tabodds”, a STATA command tabulates unadjusted and adjusted odds ratios (OR), for each level of the exposure variable against a reference level which by default was the lowest level of the social capital quintile variable[27]."
10.1371_journal.pone.0160558,ToP and demographic data were entered into SPSS version 19.
10.1371_journal.pone.0185135,"All data were analysed using the IBM SPSS Statistics 22 (IBM, NY, USA) software package."
10.1371_journal.pone.0143612,The statistical package for social science 18.0 (SPSS 18.0) program was used for statistical analysis.
10.1371_journal.pone.0137656,"Statistical analyses were performed using SPSS (version 17.0; SPSS Japan Inc., Tokyo, Japan)."
10.1371_journal.pone.0099782,"All data obtained from the communities were recorded using EPI INFO version 5 (CDC, Atlanta) and imported into Microsoft Excel."
10.1371_journal.pone.0073814,"All statistical analyses were conducted using the SPSS version 17.0 (IBM Inc., Armonk, NY, USA)."
10.1371_journal.pone.0167103,All statistical analyses were undertaken using Stata 12.
10.1371_journal.pone.0053052,The data were analysed using Statistical Analysis Systems (SAS) version 9.2.
10.1371_journal.pone.0101372,"All analyses were conducted using PASW Statistics 18 (SPSS Inc., 2009, Chicago, IL, USA) and were two-tailed with a critical p-value of 0.05."
10.1371_journal.pone.0026788,"We carried out the analyses using SPSS 10.0 (SPSS Inc., Chicago, IL, USA)."
10.1371_journal.pone.0168445,"Microsoft Excel and Statistical Package for the Social Sciences (SPSS Version 22.0; Chicago, IL, USA) were used for all data analysis."
10.1371_journal.pone.0207378,SPSS (version 24) was also used to analyse response times with repeated measures analysis of variance (ANOVA).
10.1371_journal.pone.0190254,Responses were then analyzed using SPSS version 23 to determine descriptive frequencies.
10.1371_journal.pone.0198719,"Statistical analyses were performed using Stata software, version 13 (StataCorp, College Station, TX, US)."
10.1371_journal.pone.0197483,The data analysis was carried out using SPSS version 22.
10.1371_journal.pone.0141881,A moderated hierarchical regression was performed using SPSS (IBM) to estimate the amount of variance in child birthweight explained by stressor and distress variables separately and by the interaction among stressors and maternal characteristics.
10.1371_journal.pone.0065504,"The data were entered into Epi Info version 6 and transferred into SPSS version 17 (SPSS Inc, Chicago, IL, USA)."
10.1371_journal.pone.0049748,Stimuli were presented using the Cogent 2000 toolbox (http://www.vislab.ucl.ac.uk/cogent.php) for MATLAB (The Mathworks Inc.) on LCD-goggles (Resonance Technology Inc.).
10.1371_journal.pone.0206889,"Consistent with Résibois, Verduyn, and colleagues [11], each of the obtained 384 self-reported intensity profiles following negative feedback was first transformed into a function using the linear interpolation function (interp1) implemented in MATLAB R2016b [38] and then discretised into 44 equally distanced time points, corresponding to the number of images acquired during the period that participants read and thought about the feedback."
10.1371_journal.pone.0201215,We carried out all our analyses using Stata 12 [50].
10.1371_journal.pone.0164615,"To investigate the relationship between the physiological correlates (HRV and IS) and ER as well as parental psychopathology, partial correlation tests were calculated (alpha = .05, two-tailed) with the SPSS software package (version 20, IBM, Chicago, IL, USA)."
10.1371_journal.pone.0012758,"We modeled group size for wildebeest and zebra as a function of habitat type, season and lion UD using generalized linear models in SPSS 15.0."
10.1371_journal.pone.0086283,We fit the conditional likelihood methods and estimated model parameters using maximum likelihood methods and routines in Stata 11.
10.1371_journal.pone.0161097,We used the method of random number table by SPSS to select the towns and villages.
10.1371_journal.pone.0194178,"The SPSS 22.0 software package, Chinese version, was used to analyse the data."
10.1371_journal.pone.0107543,All analyses were conducted using Stata V.11 [16].
10.1371_journal.pntd.0006622,"Data analysis was performed in Stata, version 15.0, and R, version 3.4.0."
10.1371_journal.pone.0032564,"A general linear model with 1 factor (Minitab® v15.0, α = 5%) was used to compare times to initial movement and times to trial completion (when earthworm reached the central region or the edge of the arena) when different numbers of earthworms were presented."
10.1371_journal.pone.0093821,GraphPad Prism 5.02 was used for statistical calculations.
10.1371_journal.pone.0042889,"All statistical analyses were performed using SPSS 15.0.1 for Windows (SPSS Inc., Chicago, IL, USA, 2006)."
10.1371_journal.pone.0139337,The SAS and SAS-M (Table A in S1 Text).Malay version of the Internet Addiction Test.+++End Section+++
10.1371_journal.pntd.0004424,Recurring topics were explored more in depth by revisiting the original transcripts and grouping relevant quotes in Microsoft Excel.
10.1371_journal.pone.0156150,"and the Matlab, R: and C software routines they used were used in this analysis [44,103]."
10.1371_journal.pone.0025948,Statistical analyses were performed using SPSS© version 18.0 (Statistical Package for the Social Sciences).
10.1371_journal.pone.0168748,Descriptive statistics were performed using Graphpad Prism 6.
10.1371_journal.pone.0040101,"All meta-analyses and statistical analyses in the pooled individual-level data were performed using Stata SE 11.0 (Stata Corporation, College Station, Texas, USA)."
10.1371_journal.pone.0170973,We used MATLAB to run the task and collect participants’ responses.
10.1371_journal.pone.0032002,"All statistical analyses were conducted using the computer program SPSS (version 18.0, SPSS, Inc., Chicago, IL)."
10.1371_journal.pone.0185661,"All analyses accounted for complex survey design using SUDAAN 11.0 (RTI, Research Triangle Park, North Carolina) and were weighted to account for the selection of HCHS/ SOL participants with unequal probabilities [24] and were performed using SAS version 9.3 (SAS Institute, Cary, NC) and SUDAAN release 11.0.1 (RTI International, Research Triangle Park, NC)."
10.1371_journal.pone.0197023,"Generalized Linear Mixed Models (GLMM) analyses were conducted, using IBM SPSS Statistics, Version 25, to examine the effects of tDCS on patients’ performance on social cognitive, neurocognitive, and EEG measures."
10.1371_journal.pone.0167719,These data were analysed using SPSS (version 21) for Windows.
10.1371_journal.pone.0195163,"We used STATA 13.0 (College Station, TX) for all analyses."
10.1371_journal.pone.0197961,All statistical analyses were conducted using SPSS Statistics 23.0 and AMOS version 23.0.
10.1371_journal.pone.0167398,SPSS 18.0 and Mplus 7.0 (using an exploratory LPA) were used to analyze the data.
10.1371_journal.pone.0147274,The data was analysed using EpiData Analysis software (Version 3.1.80) and Stata (Version 12).
10.1371_journal.pone.0155617,Scores were calculated using the “PCA” and “predict” commands in Stata.
10.1371_journal.pone.0149395,All analyses were undertaken using the IBM SPSS 22 software.
10.1371_journal.pone.0033690,All analyses were performed with SAS software 8.2 (USA).
10.1371_journal.pone.0096355,"In order to analyse the relationships between ‘number of teeth’ and anthropometric measures, we categorised participants into five approximately equal sized groups (using xtile in stata) based on number of paired of teeth (teeth are known to erupt in pairs), both for clarity and to maximize statistical power."
10.1371_journal.pone.0048076,"Once extracted, ROI βs were submitted for analysis in SPSS."
10.1371_journal.pone.0175923,All data were analyzed with SPSS version 21.0 [34].
10.1371_journal.pone.0137126,"Rxy(τ)=1Nt−1∑tNt−τ(x(t+τ)−x¯)(y(t)−y¯)σxσy(1)The linear trend of time series signals (x(t) and y(t)) was excluded using the “detrend” function of MATLAB (The MathWorks Inc, USA) and the signals were filtered using Hanning windows of the same size as the data length before their cross correlation was calculated (the MATLAB’s “detrend” function computes the least-squares fit of a straight line to the data in question and subtracts the resulting function from the data)."
10.1371_journal.pone.0178359,"On average, the online survey took approximately 10–15 minutes to complete and data collected was downloaded from Questionpro in SPSS’s data file format."
10.1371_journal.pone.0158056,All analyses were conducted using STATA v9 and all p-values refer to two-tailed tests.
10.1371_journal.pone.0094295,All the analyses in this paper were performed with STATA 11.0 software.
10.1371_journal.pone.0092862,Statistical analyses were performed using PASW Statistics version 18 for Windows (SPSS Inc.).
10.1371_journal.pone.0008775,"All statistical analyses were performed using the statistical package SAS, version 9.1 (SAS Institute, Inc., Cary, North Carolina)."
10.1371_journal.pone.0049714,"The data was analyzed using SPSS® version 17.0 (SPSS Inc., Chicago, IL, USA) for Windows®."
10.1371_journal.pone.0066353,All analysis was completed using Stata Version 11.0.
10.1371_journal.pone.0081836,Interviews were transcribed and then manually coded using Microsoft Word and Excel.
10.1371_journal.pone.0129805,"All statistical analyses were conducted using SPSS Statistics 22 (Dynelytics, Zurich, Switzerland)."
10.1371_journal.pone.0131604,"All statistical analyses were performed using SPSS version 19 (IBM Corp., Armonk, NY)."
10.1371_journal.pone.0205887,All analyses were run in SPSS 25.
10.1371_journal.pone.0146886,Lesion and whole brain areas for each slice were brought into Excel for final volume calculations.
10.1371_journal.pone.0100188,"Statistics were carried out using PASW Statistic 18 software (SPSS Inc., Chicago, IL, USA)."
10.1371_journal.pone.0190921,"Here, we used a derivative of a Gaussian filter as a temporal gradient filter suggested by Simoncelli and colleagues [28] (see also MATLAB built-in function opticalFlowLKDoG)."
10.1371_journal.pone.0041805,"Results were computed using SPSS ver.15 (SPSS Inc, Illinois, USA), employing the ‘Complex Samples’ procedure required when using probability weights."
10.1371_journal.pone.0170204,"Crude and adjusted relative risks (RR) for dependence at 12, 24 and 36 months were statistically assessed by Poisson regression model using Statistical Analysis System software version 9.2 with PROC GENMOD (SAS Institute Inc, Cary, NC) [21,22]."
10.1371_journal.pone.0012758,"Group composition, as measured by the proportion of females in each group (arcsin transformed for analysis), was similarly modeled using generalized linear models in SPSS 15.0."
10.1371_journal.pone.0002868,"ANOVAs were also performed with a between-subject factor of “attachment style” (SAS, AXS, or AVS, as determined individually by AAQ scores), to examine whether these individual traits would modulate visual inspection times, but these analyses showed no main effect of attachment nor interaction with conditions (all Fs<1.1)."
10.1371_journal.pone.0185733,"Instead, we applied a custom built MATLAB routine (using the speech processing toolbox ‘voicebox’ in MATLAB v. R2014a) to extract acoustic ‘features’ (mel-frequency cepstral coefficients; MFCCs) from single screams and chorus excerpts."
10.1371_journal.pone.0154496,"Statistically significant moderation paths (see Fig 2) were probed using PROCESS, an add-on for SPSS [32]."
10.1371_journal.pone.0171782,All statistical tests were analysed using IBM SPSS version 22.
10.1371_journal.pone.0043294,The models were run using xtlogit in Stata 11.2 with a maximum likelihood estimation procedure.
10.1371_journal.pone.0106749,"Statistical analysis was performed with SPSS version 20 software (IBM Corporation, Armonk, New York, USA)."
